{
  "schema_version": 1,
  "registry_kind": "velvetos_sensor_registry",
  "suite_runner": "scripts/check-all.py",
  "sensors": [
    {
      "id": "check-agent-security-conformance",
      "path": "scripts/check-agent-security-conformance.py",
      "owns": [
        "packages/vfharness/security/**",
        "scripts/check-agent-security-conformance.py"
      ],
      "triggered_by": [
        "packages/vfharness/security/**",
        "scripts/check-agent-security-conformance.py"
      ],
      "depends_on": [
        "check-agent-surface-security",
        "check-control-api",
        "check-behavioral-evals"
      ],
      "enforces": [],
      "lifecycle": "DOMAIN",
      "risk": "high",
      "timeout_seconds": 180,
      "failure_effect": {
        "merge": "BLOCK",
        "release": "BLOCK_IF_RELEVANT",
        "runtime": "NO_DIRECT_RUNTIME_EFFECT"
      },
      "fallback_scope": "FULL_SUITE",
      "mapping_state": "mapped"
    },
    {
      "id": "check-agent-surface-security",
      "path": "scripts/check-agent-surface-security.py",
      "owns": [
        "scripts/check-agent-surface-security.py"
      ],
      "triggered_by": [
        ".cursor/**",
        "scripts/check-agent-surface-security.py"
      ],
      "depends_on": [],
      "enforces": [
        "repository.agent_surface.secrets"
      ],
      "lifecycle": "CORE",
      "risk": "critical",
      "timeout_seconds": 180,
      "failure_effect": {
        "merge": "BLOCK",
        "release": "BLOCK_IF_RELEVANT",
        "runtime": "NO_DIRECT_RUNTIME_EFFECT"
      },
      "fallback_scope": "ALWAYS_ON",
      "mapping_state": "mapped"
    },
    {
      "id": "check-behavioral-evals",
      "path": "scripts/check-behavioral-evals.py",
      "owns": [
        "packages/vfharness/evals/**",
        "scripts/check-behavioral-evals.py",
        "tools/promptfoo/**"
      ],
      "triggered_by": [
        "packages/vfharness/evals/**",
        "tools/promptfoo/**",
        "scripts/check-behavioral-evals.py"
      ],
      "depends_on": [],
      "enforces": [],
      "lifecycle": "DOMAIN",
      "risk": "medium",
      "timeout_seconds": 180,
      "failure_effect": {
        "merge": "BLOCK",
        "release": "BLOCK_IF_RELEVANT",
        "runtime": "NO_DIRECT_RUNTIME_EFFECT"
      },
      "fallback_scope": "FULL_SUITE",
      "mapping_state": "mapped"
    },
    {
      "id": "check-brand-asset-cta-lock",
      "path": "scripts/check-brand-asset-cta-lock.py",
      "owns": [
        "packages/vfgrowth/preflight/TEMPLATE.md",
        "packages/vfom/BRAND-ASSET-LOCK.md",
        "packages/vfom/tests/publication-prep-coldstart.json",
        "scripts/check-brand-asset-cta-lock.py",
        "scripts/vf_send_preflight.py"
      ],
      "triggered_by": [
        "packages/vfgrowth/preflight/TEMPLATE.md",
        "packages/vfom/BRAND-ASSET-LOCK.md",
        "packages/vfom/tests/publication-prep-coldstart.json",
        "scripts/check-brand-asset-cta-lock.py",
        "scripts/vf_send_preflight.py"
      ],
      "depends_on": [],
      "enforces": [],
      "lifecycle": "DOMAIN",
      "risk": "high",
      "timeout_seconds": 180,
      "failure_effect": {
        "merge": "BLOCK",
        "release": "BLOCK_IF_RELEVANT",
        "runtime": "NO_DIRECT_RUNTIME_EFFECT"
      },
      "fallback_scope": "FULL_SUITE",
      "mapping_state": "mapped"
    },
    {
      "id": "check-brand-tokens",
      "path": "scripts/check-brand-tokens.py",
      "owns": [
        "packages/vfbrand/**",
        "packages/vfom/**",
        "scripts/check-brand-tokens.py"
      ],
      "triggered_by": [
        "packages/vfbrand/**",
        "packages/vfom/**",
        "scripts/check-brand-tokens.py"
      ],
      "depends_on": [],
      "enforces": [],
      "lifecycle": "DOMAIN",
      "risk": "medium",
      "timeout_seconds": 60,
      "failure_effect": {
        "merge": "BLOCK",
        "release": "BLOCK_IF_RELEVANT",
        "runtime": "NO_DIRECT_RUNTIME_EFFECT"
      },
      "fallback_scope": "FULL_SUITE",
      "mapping_state": "mapped"
    },
    {
      "id": "check-changelog-fragments",
      "path": "scripts/check-changelog-fragments.py",
      "owns": [
        "changelog.d/**",
        "scripts/changelog-compile.py",
        "scripts/changelog_contract.py",
        "scripts/check-changelog-fragments.py"
      ],
      "triggered_by": [
        "changelog.d/**",
        "scripts/changelog-compile.py",
        "scripts/changelog_contract.py",
        "scripts/check-changelog-fragments.py"
      ],
      "depends_on": [],
      "enforces": [],
      "lifecycle": "DOMAIN",
      "risk": "medium",
      "timeout_seconds": 60,
      "failure_effect": {
        "merge": "BLOCK",
        "release": "BLOCK_IF_RELEVANT",
        "runtime": "NO_DIRECT_RUNTIME_EFFECT"
      },
      "fallback_scope": "FULL_SUITE",
      "mapping_state": "mapped"
    },
    {
      "id": "check-chat-cold-start-preflight",
      "path": "scripts/check-chat-cold-start-preflight.py",
      "owns": [
        "instances/velvet-factory/distribution/chatgpt-project/**",
        "scripts/check-chat-cold-start-preflight.py",
        "scripts/vf_chat_cold_start_preflight.py",
        "scripts/vf_source_ingest.py"
      ],
      "triggered_by": [
        "instances/velvet-factory/distribution/chatgpt-project/**",
        "scripts/check-chat-cold-start-preflight.py",
        "scripts/vf_chat_cold_start_preflight.py",
        "scripts/vf_source_ingest.py"
      ],
      "depends_on": [],
      "enforces": [],
      "lifecycle": "DOMAIN",
      "risk": "medium",
      "timeout_seconds": 180,
      "failure_effect": {
        "merge": "BLOCK",
        "release": "BLOCK_IF_RELEVANT",
        "runtime": "NO_DIRECT_RUNTIME_EFFECT"
      },
      "fallback_scope": "FULL_SUITE",
      "mapping_state": "mapped"
    },
    {
      "id": "check-chat-runtime-bundle",
      "path": "scripts/check-chat-runtime-bundle.py",
      "owns": [
        "instances/velvet-factory/distribution/chatgpt-project/ASSET-MANIFEST-v6.6.4.json",
        "scripts/check-chat-runtime-bundle.py"
      ],
      "triggered_by": [
        "instances/velvet-factory/distribution/chatgpt-project/ASSET-MANIFEST-v6.6.4.json",
        "scripts/check-chat-runtime-bundle.py"
      ],
      "depends_on": [],
      "enforces": [],
      "lifecycle": "DOMAIN",
      "risk": "medium",
      "timeout_seconds": 180,
      "failure_effect": {
        "merge": "BLOCK",
        "release": "BLOCK_IF_RELEVANT",
        "runtime": "NO_DIRECT_RUNTIME_EFFECT"
      },
      "fallback_scope": "FULL_SUITE",
      "mapping_state": "mapped"
    },
    {
      "id": "check-cli-anything-pilot",
      "path": "scripts/check-cli-anything-pilot.py",
      "owns": [
        "packages/vfharness/cost-preflight/**",
        "packages/vfharness/devtools/**",
        "scripts/check-cli-anything-pilot.py",
        "scripts/vf_cad.py",
        "scripts/vf_cli_anything.py"
      ],
      "triggered_by": [
        "packages/vfharness/devtools/**",
        "packages/vfharness/cost-preflight/**",
        "scripts/check-cli-anything-pilot.py"
      ],
      "depends_on": [
        "scripts/vf_cli_anything.py",
        "scripts/vf_cad.py"
      ],
      "enforces": [],
      "lifecycle": "DOMAIN",
      "risk": "medium",
      "timeout_seconds": 180,
      "failure_effect": {
        "merge": "BLOCK",
        "release": "BLOCK_IF_RELEVANT",
        "runtime": "NO_DIRECT_RUNTIME_EFFECT"
      },
      "fallback_scope": "FULL_SUITE",
      "mapping_state": "mapped"
    },
    {
      "id": "check-cloudflare-publish-fingerprint",
      "path": "scripts/check-cloudflare-publish-fingerprint.py",
      "owns": [
        "packages/vfigos/**",
        "scripts/check-cloudflare-publish-fingerprint.py"
      ],
      "triggered_by": [
        "packages/vfigos/**",
        "scripts/check-cloudflare-publish-fingerprint.py"
      ],
      "depends_on": [],
      "enforces": [],
      "lifecycle": "DOMAIN",
      "risk": "high",
      "timeout_seconds": 180,
      "failure_effect": {
        "merge": "BLOCK",
        "release": "BLOCK_IF_RELEVANT",
        "runtime": "NO_DIRECT_RUNTIME_EFFECT"
      },
      "fallback_scope": "FULL_SUITE",
      "mapping_state": "mapped"
    },
    {
      "id": "check-cognee-integration",
      "path": "scripts/check-cognee-integration.py",
      "owns": [
        "automation/**",
        "packages/vfmem/**",
        "scripts/check-cognee-integration.py",
        "scripts/vfmem.py"
      ],
      "triggered_by": [
        "automation/**",
        "packages/vfmem/**",
        "scripts/check-cognee-integration.py",
        "scripts/vfmem.py"
      ],
      "depends_on": [],
      "enforces": [],
      "lifecycle": "DOMAIN",
      "risk": "medium",
      "timeout_seconds": 180,
      "failure_effect": {
        "merge": "BLOCK",
        "release": "BLOCK_IF_RELEVANT",
        "runtime": "NO_DIRECT_RUNTIME_EFFECT"
      },
      "fallback_scope": "FULL_SUITE",
      "mapping_state": "mapped"
    },
    {
      "id": "check-commission-isolation",
      "path": "scripts/check-commission-isolation.py",
      "owns": [
        "scripts/check-commission-isolation.py",
        "scripts/commission_operational_gaps.py",
        "scripts/sensor_isolation.py"
      ],
      "triggered_by": [
        "scripts/check-commission-isolation.py"
      ],
      "depends_on": [
        "scripts/commission_operational_gaps.py",
        "scripts/sensor_isolation.py"
      ],
      "enforces": [],
      "lifecycle": "DOMAIN",
      "risk": "medium",
      "timeout_seconds": 180,
      "failure_effect": {
        "merge": "BLOCK",